{
    "$schema": "./workflow-routes.schema.json",
    "version": 1,
    "routingPolicy": {
        "defaultUserFacingAgents": [
            "software-workflow-entry",
            "software-workflow-orchestrator",
            "work-resumption"
        ],
        "specialistAccess": "Specialist phase agents are subagent-first and hidden from broad direct picker use. They remain reachable through controller handoffs and explicit phase override requests.",
        "callerModel": "Only controller agents invoke other agents automatically. Specialist agents return artifacts, missing prerequisites, questions, or recommended next phases to the controller.",
        "parallelism": "Sequential by default. Parallel work is allowed only for independent read-only investigations whose outputs fan back into a controller before decisions or file mutations.",
        "handoffOwnership": "Use user-choice handoffs for material tradeoffs or explicit phase selection; use agent-determined handoffs for clear routing and missing-prerequisite returns; use approval-gated handoffs for destructive or history-changing Git work."
    },
    "parallelPolicies": {
        "controller-sequential": {
            "summary": "Owns conversation or phase routing and should make decisions sequentially after any fan-in.",
            "mayRunInParallel": false
        },
        "read-only-parallel-eligible": {
            "summary": "May run in parallel only when scoped to independent read-only evidence gathering or planning surfaces.",
            "mayRunInParallel": true
        },
        "sequential-decision": {
            "summary": "Read-only, but depends on a stable artifact or makes a readiness decision, so it should not run in parallel on the same task.",
            "mayRunInParallel": false
        },
        "writer-sequential": {
            "summary": "Writes files and must not overlap with any other file writer, formatter, migration, dependency change, or Git mutation.",
            "mayRunInParallel": false
        },
        "git-sequential": {
            "summary": "Inspects or mutates Git state and must run against a stable repository state with explicit approval for risky operations.",
            "mayRunInParallel": false
        },
        "verification-sequential": {
            "summary": "Validates settled changes after mutation stops and decides whether work is complete or loops back.",
            "mayRunInParallel": false
        }
    },
    "handoffTypes": {
        "user-choice": "The user chooses the next route because ambiguity, scope, tradeoff, cost, security, migration, or acceptance risk remains.",
        "agent-determined": "The current agent can choose the next route from available evidence and prerequisites.",
        "approval-gated": "The next route or operation requires explicit user approval before mutation or risk acceptance."
    },
    "agents": [
        {
            "agentId": "software-workflow-entry",
            "role": "controller-entry",
            "file": "agents/software-workflow-entry.agent.md",
            "userFacing": "default",
            "allowedCallers": [
                "user"
            ],
            "canInvoke": [
                "software-workflow-orchestrator",
                "work-resumption",
                "context-discovery",
                "requirements-synthesis",
                "strategy-evaluation",
                "follow-up-work-items",
                "scope-creep-review",
                "runtime-options-assessment",
                "runtime-decision-review",
                "authentication-planning",
                "authentication-review",
                "data-model-planning",
                "ci-cd-pipeline-planning",
                "ci-cd-pipeline-creation",
                "git-workflow-planning",
                "git-troubleshooting",
                "git-conflict-resolution",
                "git-advanced-operations",
                "code-comment-audit",
                "code-comment-authoring",
                "solution-planning",
                "plan-review",
                "documentation",
                "implementation",
                "verification"
            ],
            "writesFiles": false,
            "mutatesRepoState": false,
            "canRunCommands": false,
            "parallelPolicy": "controller-sequential",
            "prerequisites": [
                "User prompt"
            ],
            "handoffs": [
                {
                    "to": "software-workflow-orchestrator",
                    "type": "agent-determined",
                    "when": "The prompt is clearly new work."
                },
                {
                    "to": "work-resumption",
                    "type": "agent-determined",
                    "when": "The prompt refers to existing or interrupted work and no explicit phase was named."
                },
                {
                    "to": "phase-specialist",
                    "type": "user-choice",
                    "when": "The user explicitly names a phase or chooses a continuation after resumption."
                }
            ],
            "approvalGates": [],
            "cycleGroup": "entry",
            "notes": "Initial classifier. It does not implement code changes or build full plans except when asked only for routing advice."
        },
        {
            "agentId": "software-workflow-orchestrator",
            "role": "controller-orchestrator",
            "file": "agents/software-workflow-orchestrator.agent.md",
            "userFacing": "default",
            "allowedCallers": [
                "user",
                "software-workflow-entry"
            ],
            "canInvoke": [
                "context-discovery",
                "requirements-synthesis",
                "strategy-evaluation",
                "follow-up-work-items",
                "scope-creep-review",
                "runtime-options-assessment",
                "runtime-decision-review",
                "authentication-planning",
                "authentication-review",
                "data-model-planning",
                "ci-cd-pipeline-planning",
                "ci-cd-pipeline-creation",
                "git-workflow-planning",
                "git-troubleshooting",
                "git-conflict-resolution",
                "git-advanced-operations",
                "code-comment-audit",
                "code-comment-authoring",
                "solution-planning",
                "plan-review",
                "documentation",
                "implementation",
                "verification",
                "work-resumption"
            ],
            "writesFiles": false,
            "mutatesRepoState": false,
            "canRunCommands": true,
            "parallelPolicy": "controller-sequential",
            "prerequisites": [
                "New-work classification or direct user invocation for new work"
            ],
            "handoffs": [
                {
                    "to": "context-discovery",
                    "type": "agent-determined",
                    "when": "Facts, relevant files, constraints, or risks are unknown."
                },
                {
                    "to": "requirements-synthesis",
                    "type": "agent-determined",
                    "when": "Enough facts exist to define scope and acceptance criteria."
                },
                {
                    "to": "specialty-phase",
                    "type": "agent-determined",
                    "when": "The accepted scope involves strategy, runtime, authentication, data, CI/CD, Git, or comment decisions."
                },
                {
                    "to": "solution-planning",
                    "type": "agent-determined",
                    "when": "Requirements and needed specialty decisions are ready for implementation planning."
                },
                {
                    "to": "implementation",
                    "type": "agent-determined",
                    "when": "Requirements, plan, review outcome, and documentation decision are complete."
                },
                {
                    "to": "user",
                    "type": "user-choice",
                    "when": "Material tradeoffs affect behavior, cost, security, data migration, destructive operations, or accepted risk."
                }
            ],
            "approvalGates": [
                "Destructive operations",
                "Reverting user changes",
                "Dependency changes outside the approved plan",
                "Verification failures outside the approved scope"
            ],
            "cycleGroup": "new-work-spine",
            "notes": "Main conversation owner for new work. It coordinates fan-out and fan-in and keeps specialists from competing for the user thread."
        },
        {
            "agentId": "work-resumption",
            "role": "controller-resumption",
            "file": "agents/work-resumption.agent.md",
            "userFacing": "default",
            "allowedCallers": [
                "user",
                "software-workflow-entry",
                "software-workflow-orchestrator"
            ],
            "canInvoke": [
                "context-discovery",
                "requirements-synthesis",
                "strategy-evaluation",
                "follow-up-work-items",
                "scope-creep-review",
                "runtime-options-assessment",
                "runtime-decision-review",
                "authentication-planning",
                "authentication-review",
                "data-model-planning",
                "ci-cd-pipeline-planning",
                "ci-cd-pipeline-creation",
                "git-workflow-planning",
                "git-troubleshooting",
                "git-conflict-resolution",
                "git-advanced-operations",